{
  "$schema": "https://json-schema.org/draft/2020-12/schema",
  "type": "object",
  "required": [
    "version",
    "id",
    "allowed_hosts",
    "request_interval_ms",
    "max_bytes",
    "max_total_bytes",
    "max_documents",
    "timeout_ms",
    "retries",
    "entries"
  ],
  "properties": {
    "version": {
      "const": "1.0.0"
    },
    "id": {
      "type": "string",
      "minLength": 1,
      "maxLength": 4096
    },
    "allowed_hosts": {
      "type": "array",
      "minItems": 1,
      "maxItems": 32,
      "uniqueItems": true,
      "items": {
        "type": "string",
        "minLength": 1,
        "maxLength": 4096
      }
    },
    "request_interval_ms": {
      "type": "integer",
      "minimum": 100,
      "maximum": 60000
    },
    "max_bytes": {
      "type": "integer",
      "minimum": 1,
      "maximum": 52428800
    },
    "max_total_bytes": {
      "type": "integer",
      "minimum": 1,
      "maximum": 524288000
    },
    "max_documents": {
      "type": "integer",
      "minimum": 1,
      "maximum": 1000
    },
    "timeout_ms": {
      "type": "integer",
      "minimum": 1000,
      "maximum": 60000
    },
    "retries": {
      "type": "integer",
      "minimum": 0,
      "maximum": 3
    },
    "entries": {
      "type": "array",
      "maxItems": 1000,
      "items": {
        "type": "object",
        "required": [
          "id",
          "url",
          "media_type",
          "license"
        ],
        "properties": {
          "id": {
            "type": "string",
            "minLength": 1,
            "maxLength": 4096
          },
          "url": {
            "type": "string",
            "minLength": 1,
            "maxLength": 4096
          },
          "media_type": {
            "enum": [
              "application/pdf",
              "application/json",
              "text/html",
              "text/plain"
            ]
          },
          "expected_sha256": {
            "type": "string",
            "pattern": "^[a-f0-9]{64}$"
          },
          "license": {
            "type": "object",
            "required": [
              "redistribution"
            ],
            "properties": {
              "redistribution": {
                "enum": [
                  "allowed",
                  "restricted",
                  "unknown"
                ]
              }
            },
            "additionalProperties": true
          },
          "metadata": {
            "type": "object"
          }
        },
        "additionalProperties": true
      }
    }
  },
  "additionalProperties": true
}
