{"version": "1.0.0", "id": "documented-court-fixture", "allowed_hosts": ["www.supremecourt.gov", "www.govinfo.gov"], "request_interval_ms": 1000, "max_bytes": 52428800, "max_total_bytes": 104857600, "max_documents": 3, "timeout_ms": 30000, "retries": 0, "entries": [{"id": "scotus:22-451:loper-bright", "url": "https://www.supremecourt.gov/opinions/23pdf/22-451_7m58.pdf", "media_type": "application/pdf", "license": {"redistribution": "unknown"}}, {"id": "scotus:23-939:trump-v-united-states", "url": "https://www.supremecourt.gov/opinions/23pdf/23-939_e2pg.pdf", "media_type": "application/pdf", "license": {"redistribution": "unknown"}}, {"id": "dcd:1-20-cv-03010:opinion", "url": "https://www.govinfo.gov/content/pkg/USCOURTS-dcd-1_20-cv-03010/pdf/USCOURTS-dcd-1_20-cv-03010-0.pdf", "media_type": "application/pdf", "license": {"redistribution": "unknown"}}]}